{
  "$schema": "https://json-schema.org/draft/2020-12/schema",
  "title": "observability-completion-v2 contract v4",
  "type": "object",
  "additionalProperties": false,
  "required": [
    "surface",
    "major_version",
    "schema_version",
    "compatibility",
    "metrics"
  ],
  "properties": {
    "surface": {
      "type": "string",
      "const": "observability-completion-v2"
    },
    "major_version": {
      "type": "integer",
      "const": 4
    },
    "schema_version": {
      "type": "integer",
      "const": 1
    },
    "compatibility": {
      "type": "object",
      "additionalProperties": false,
      "required": [
        "breaking_change_requires_major_bump",
        "breaking_change_requires_migration_note"
      ],
      "properties": {
        "breaking_change_requires_major_bump": {
          "type": "boolean",
          "const": true
        },
        "breaking_change_requires_migration_note": {
          "type": "boolean",
          "const": true
        }
      }
    },
    "metrics": {
      "type": "object",
      "additionalProperties": false,
      "required": [
        "trigger_mode_counter_prefix",
        "parity_drift_counter_prefix",
        "member_access_terminal_empty_counter_prefix",
        "completion_result_counter_prefix",
        "completion_route_counter_prefix",
        "completion_fail_closed_cause_counter_prefix",
        "completion_head_to_exact_upgrade_counter",
        "completion_head_to_exact_upgrade_histogram",
        "interactive_fail_closed_reason_counter_prefix",
        "interactive_wait_budget_exhausted_counter",
        "runtime_queue_wait_interactive_counter",
        "runtime_queue_wait_background_counter",
        "runtime_exec_interactive_counter",
        "runtime_exec_background_counter",
        "runtime_queue_wait_interactive_histogram",
        "runtime_queue_wait_background_histogram",
        "runtime_exec_interactive_histogram",
        "runtime_exec_background_histogram",
        "anti_rescue_guard_zero_expected_counters",
        "allowed_trigger_modes",
        "allowed_terminal_empty_reasons",
        "allowed_fail_closed_reasons",
        "allowed_fail_closed_origins",
        "allowed_fail_closed_operations",
        "allowed_completion_outcomes",
        "allowed_completion_routes",
        "allowed_completion_fail_closed_causes"
      ],
      "properties": {
        "trigger_mode_counter_prefix": {
          "type": "string",
          "const": "intellisense_v2_completion_trigger_mode_total_mode_"
        },
        "parity_drift_counter_prefix": {
          "type": "string",
          "const": "intellisense_v2_completion_parity_drift_total_mode_"
        },
        "member_access_terminal_empty_counter_prefix": {
          "type": "string",
          "const": "intellisense_v2_completion_member_access_terminal_empty_total_mode_"
        },
        "completion_result_counter_prefix": {
          "type": "string",
          "const": "intellisense_v2_completion_result_total_"
        },
        "completion_route_counter_prefix": {
          "type": "string",
          "const": "intellisense_v2_completion_route_total_route_"
        },
        "completion_fail_closed_cause_counter_prefix": {
          "type": "string",
          "const": "intellisense_v2_completion_fail_closed_cause_total_cause_"
        },
        "completion_head_to_exact_upgrade_counter": {
          "type": "string",
          "const": "intellisense_v2_completion_head_to_exact_upgrade_total"
        },
        "completion_head_to_exact_upgrade_histogram": {
          "type": "string",
          "const": "intellisense_v2_completion_head_to_exact_upgrade_ms"
        },
        "interactive_fail_closed_reason_counter_prefix": {
          "type": "string",
          "const": "intellisense_v2_fail_closed_reason_total_origin_"
        },
        "interactive_wait_budget_exhausted_counter": {
          "type": "string",
          "const": "intellisense_v2_interactive_wait_budget_exhausted_total"
        },
        "runtime_queue_wait_interactive_counter": {
          "type": "string",
          "const": "intellisense_v2_runtime_queue_wait_interactive_total"
        },
        "runtime_queue_wait_background_counter": {
          "type": "string",
          "const": "intellisense_v2_runtime_queue_wait_background_total"
        },
        "runtime_exec_interactive_counter": {
          "type": "string",
          "const": "intellisense_v2_runtime_exec_interactive_total"
        },
        "runtime_exec_background_counter": {
          "type": "string",
          "const": "intellisense_v2_runtime_exec_background_total"
        },
        "runtime_queue_wait_interactive_histogram": {
          "type": "string",
          "const": "intellisense_v2_runtime_queue_wait_interactive_ms"
        },
        "runtime_queue_wait_background_histogram": {
          "type": "string",
          "const": "intellisense_v2_runtime_queue_wait_background_ms"
        },
        "runtime_exec_interactive_histogram": {
          "type": "string",
          "const": "intellisense_v2_runtime_exec_interactive_ms"
        },
        "runtime_exec_background_histogram": {
          "type": "string",
          "const": "intellisense_v2_runtime_exec_background_ms"
        },
        "anti_rescue_guard_zero_expected_counters": {
          "type": "array",
          "minItems": 2,
          "uniqueItems": true,
          "items": {
            "type": "string",
            "enum": [
              "intellisense_v2_interactive_stale_served_total",
              "intellisense_v2_completion_stale_fallback_total"
            ]
          }
        },
        "allowed_trigger_modes": {
          "type": "array",
          "minItems": 4,
          "uniqueItems": true,
          "items": {
            "type": "string",
            "enum": [
              "trigger_character",
              "invoked",
              "trigger_for_incomplete",
              "none"
            ]
          }
        },
        "allowed_terminal_empty_reasons": {
          "type": "array",
          "minItems": 6,
          "uniqueItems": true,
          "items": {
            "type": "string",
            "enum": [
              "ok_empty",
              "missing_canonical_ir",
              "missing_semantic_index",
              "superseded_revision",
              "cancelled",
              "unavailable_by_contract"
            ]
          }
        },
        "allowed_fail_closed_reasons": {
          "type": "array",
          "minItems": 5,
          "uniqueItems": true,
          "items": {
            "type": "string",
            "enum": [
              "missing_canonical_ir",
              "missing_semantic_index",
              "superseded_revision",
              "cancelled",
              "unavailable_by_contract"
            ]
          }
        },
        "allowed_fail_closed_origins": {
          "type": "array",
          "minItems": 4,
          "uniqueItems": true,
          "items": {
            "type": "string",
            "enum": [
              "lsp",
              "web",
              "agent",
              "runtime"
            ]
          }
        },
        "allowed_fail_closed_operations": {
          "type": "array",
          "minItems": 6,
          "uniqueItems": true,
          "items": {
            "type": "string",
            "enum": [
              "completion",
              "hover",
              "signature_help",
              "definition",
              "members",
              "type_at_position"
            ]
          }
        },
        "allowed_completion_outcomes": {
          "type": "array",
          "minItems": 5,
          "uniqueItems": true,
          "items": {
            "type": "string",
            "enum": [
              "ok_non_empty",
              "ok_empty",
              "fail_closed",
              "cancelled",
              "handler_error"
            ]
          }
        },
        "allowed_completion_routes": {
          "type": "array",
          "minItems": 2,
          "uniqueItems": true,
          "items": {
            "type": "string",
            "enum": [
              "head_hit",
              "exact_hit"
            ]
          }
        },
        "allowed_completion_fail_closed_causes": {
          "type": "array",
          "minItems": 2,
          "uniqueItems": true,
          "items": {
            "type": "string",
            "enum": [
              "prepare_timeout",
              "exact_deadline"
            ]
          }
        }
      }
    }
  }
}
