{
  "surface": "observability-completion-v2",
  "major_version": 4,
  "schema_version": 1,
  "compatibility": {
    "breaking_change_requires_major_bump": true,
    "breaking_change_requires_migration_note": true
  },
  "metrics": {
    "trigger_mode_counter_prefix": "intellisense_v2_completion_trigger_mode_total_mode_",
    "parity_drift_counter_prefix": "intellisense_v2_completion_parity_drift_total_mode_",
    "member_access_terminal_empty_counter_prefix": "intellisense_v2_completion_member_access_terminal_empty_total_mode_",
    "completion_result_counter_prefix": "intellisense_v2_completion_result_total_",
    "completion_route_counter_prefix": "intellisense_v2_completion_route_total_route_",
    "completion_fail_closed_cause_counter_prefix": "intellisense_v2_completion_fail_closed_cause_total_cause_",
    "completion_head_to_exact_upgrade_counter": "intellisense_v2_completion_head_to_exact_upgrade_total",
    "completion_head_to_exact_upgrade_histogram": "intellisense_v2_completion_head_to_exact_upgrade_ms",
    "interactive_fail_closed_reason_counter_prefix": "intellisense_v2_fail_closed_reason_total_origin_",
    "interactive_wait_budget_exhausted_counter": "intellisense_v2_interactive_wait_budget_exhausted_total",
    "runtime_queue_wait_interactive_counter": "intellisense_v2_runtime_queue_wait_interactive_total",
    "runtime_queue_wait_background_counter": "intellisense_v2_runtime_queue_wait_background_total",
    "runtime_exec_interactive_counter": "intellisense_v2_runtime_exec_interactive_total",
    "runtime_exec_background_counter": "intellisense_v2_runtime_exec_background_total",
    "runtime_queue_wait_interactive_histogram": "intellisense_v2_runtime_queue_wait_interactive_ms",
    "runtime_queue_wait_background_histogram": "intellisense_v2_runtime_queue_wait_background_ms",
    "runtime_exec_interactive_histogram": "intellisense_v2_runtime_exec_interactive_ms",
    "runtime_exec_background_histogram": "intellisense_v2_runtime_exec_background_ms",
    "anti_rescue_guard_zero_expected_counters": [
      "intellisense_v2_interactive_stale_served_total",
      "intellisense_v2_completion_stale_fallback_total"
    ],
    "allowed_trigger_modes": [
      "trigger_character",
      "invoked",
      "trigger_for_incomplete",
      "none"
    ],
    "allowed_terminal_empty_reasons": [
      "ok_empty",
      "missing_canonical_ir",
      "missing_semantic_index",
      "superseded_revision",
      "cancelled",
      "unavailable_by_contract"
    ],
    "allowed_fail_closed_reasons": [
      "missing_canonical_ir",
      "missing_semantic_index",
      "superseded_revision",
      "cancelled",
      "unavailable_by_contract"
    ],
    "allowed_fail_closed_origins": [
      "lsp",
      "web",
      "agent",
      "runtime"
    ],
    "allowed_fail_closed_operations": [
      "completion",
      "hover",
      "signature_help",
      "definition",
      "members",
      "type_at_position"
    ],
    "allowed_completion_outcomes": [
      "ok_non_empty",
      "ok_empty",
      "fail_closed",
      "cancelled",
      "handler_error"
    ],
    "allowed_completion_routes": [
      "head_hit",
      "exact_hit"
    ],
    "allowed_completion_fail_closed_causes": [
      "prepare_timeout",
      "exact_deadline"
    ]
  }
}
